{
  "schema_version": 1,
  "id": "astro-homepage",
  "kind": "site-hosting",
  "version": "1.2.0",
  "name": "Astro Homepage",
  "description": "개인 사이트의 첫 화면과 블로그를 간결하게 시작할 수 있는 가벼운 Astro 템플릿입니다.",
  "author": "amadejjs",
  "homepage": "https://www.bloggenius.kr",
  "support": "amadejjs@naver.com",
  "created_at": "2026-10-03",
  "license": "MIT",
  "preview": {
    "path": "preview.svg",
    "sha256": "ad3bf170e5993799be317140127fb2a84259b6a98d6a2aeb1dd956e3abd0b308",
    "media_type": "image/svg+xml"
  },
  "screenshots": [],
  "compatibility": {
    "astro": "7.3.5",
    "bloggenius": ">=0.5.5"
  },
  "package": {
    "path": ".",
    "files": [
      {
        "path": "astro/LICENSE",
        "sha256": "f28e0a79b26c00aafeaa0a73b52b78989e6bc4c647ac0fdfcd6e4e6b09be203a",
        "size": 1075
      },
      {
        "path": "astro/astro.config.mjs",
        "sha256": "28d4a9a2c15ae2fefc8d2b0abdff1cb45e5d10c2daa68f278972e42270f18513",
        "size": 97
      },
      {
        "path": "astro/package-lock.json",
        "sha256": "b096be416bfc16510ab64580566397070e278173dbd81cf9d1b52233f0c8912c",
        "size": 144739
      },
      {
        "path": "astro/package.json",
        "sha256": "ad1d0a4ce5b0d96faa460d41b55e62a9d043d99e35272f4af2575cb723b46ca1",
        "size": 205
      },
      {
        "path": "astro/src/content/posts/welcome/index.md",
        "sha256": "6902b411303e3019a0a019a81eaf09f54f86c94fa29c36b9a50c9373a7203614",
        "size": 277
      },
      {
        "path": "astro/src/content.config.ts",
        "sha256": "f467408af32d644b141f1a7e0b19935ad1c286d8327480c957cc9f871a49ed7c",
        "size": 401
      },
      {
        "path": "astro/src/pages/[slug].astro",
        "sha256": "25f9f41c33cb66ec03688ca97938d04d88c927f9d95fac2bbc9c05839b0b72e5",
        "size": 1018
      },
      {
        "path": "astro/src/pages/blog/[...slug].astro",
        "sha256": "94d03931a048fc78530fc6d9e726433f897119cf9e0208df5f345e8716584bf7",
        "size": 1091
      },
      {
        "path": "astro/src/pages/blog/index.astro",
        "sha256": "4e266f2727ca0b8be71d235fe60ab00a195736ee56ad880e708b914130978a19",
        "size": 1000
      },
      {
        "path": "astro/src/pages/index.astro",
        "sha256": "fdcbb9648b6133979b8c2d46a4ae2a9657fd21ebd01e3a96b79fb62aa46438a7",
        "size": 810
      },
      {
        "path": "astro/src/site-config.json",
        "sha256": "168d001a29e35b8c4c474ec005ca821f591e5acd9d677dc0313a3b3b53666b8e",
        "size": 157
      },
      {
        "path": "astro/src/styles/global.css",
        "sha256": "148525119e00c0ff285d3fbddc8c5b0995f4b7936e9d6380a545795968c7a1ae",
        "size": 1896
      }
    ]
  },
  "site_hosting": {
    "schema_version": 1,
    "astro": {
      "source": "astro",
      "build_command": "npm run build",
      "output_directory": "dist"
    },
    "customization": {
      "schema_version": 1,
      "fields": [
        {
          "key": "site_name",
          "type": "string",
          "label": "사이트 이름",
          "default": "나의 사이트",
          "required": true,
          "target": {
            "file": "src/site-config.json",
            "path": "name"
          }
        },
        {
          "key": "logo",
          "type": "image",
          "label": "로고",
          "default": "",
          "required": false,
          "target": {
            "file": "src/site-config.json",
            "path": "logo"
          }
        },
        {
          "key": "navigation",
          "type": "navigation",
          "label": "메뉴",
          "default": [
            {
              "label": "홈",
              "href": "/"
            },
            {
              "label": "블로그",
              "href": "/blog/"
            }
          ],
          "required": true,
          "target": {
            "file": "src/site-config.json",
            "path": "navigation"
          }
        }
      ]
    },
    "pages": {
      "schema_version": 1,
      "mode": "static_placeholders",
      "max_items": 12,
      "route_pattern": "/{slug}/",
      "reserved_slugs": [
        "blog"
      ],
      "target": {
        "file": "src/site-config.json",
        "path": "pages"
      }
    },
    "publishing": {
      "schema_version": 2,
      "format": "markdown",
      "content_directory": "src/content/posts",
      "post_layout": {
        "type": "per_post_directory",
        "entry_file": "index.md",
        "assets_directory": "images",
        "image_reference": "entry_relative"
      },
      "frontmatter": [
        {
          "name": "title",
          "type": "string",
          "required": true
        },
        {
          "name": "description",
          "type": "string",
          "required": true
        },
        {
          "name": "pubDate",
          "type": "date",
          "required": true
        },
        {
          "name": "is_public",
          "type": "boolean",
          "required": false,
          "default": false
        }
      ],
      "visibility": {
        "field": "is_public",
        "published_value": true,
        "default": false
      },
      "routes": {
        "listing": "/blog/",
        "detail": "/blog/{slug}/"
      }
    }
  }
}
